"One of the main police control rooms in Scotland used a false system to manipulate the response time objectives for eight years, according to documents seen by the BBC. Miles of calls to the control room of Bilston Glen were assigned to a sign ofFictitious calls known as Dumy. Internal systems would register that calls had been passed to the officers, but in their place they were parked in a list. This meant that a police vehicle would not have been sent quickly to calls that had been considered as highpriority. It seems that many calls were not attended at all. The practice, according to official police documents, was designed to ""provide artificial levels of incident management performance."" Documents reveal that Dumy's call sign was used in Bapton GlenIn Loanhead, Midlothian, from at least 2007 until the system was discovered in 2015 and stopped. The Scotland police said that the practice should not have been used after the creation of the National Police Force in 2013, and it was ""permanentlyDiscontinúo",Sad
"One of the main Scotland police control rooms used a false system to handle response time targets for eight years, according to documents seen by the BBC. Thousands of calls for the control roomde Bilston Glen were allocated to a fictitious call index known as Dumy. Internal systems would register that calls had been made to officers - but they were in place parked on a list. This meant thatA police vehicle would not have been sent quickly to calls which had been judged as a high priority. It seems that many calls were not assisted at all. Practice, according to official police documents, was designedTo ""provide artificial incident performance management performance levels"". The documents reveal that the Dumy call signal was used in Bilton Glen in Loanhead, Midlothian, from at least 2007 to the discovery of the system in 2015 andThe Scotland police said that the practice should not have been used after the creation of the national police forces in 2013 and ""definitively arrested",Sad
"One of the most important police control rooms in Scotland used a fake system to manipulate the reaction time objectives for eight years, as the BBC documents cause. Thousands of calls from the Bilston Glen -Controll space were assigned to a fictitious call sign as dumy.were passed on to the officials - but instead they were parked on a list, which meant that a police vehicle would not have been quickly sent to calls that had been judged as a high priority. It seems that many calls were not attended at all.was designed according to official police documents so that they ""deliver artificial levels of incident management performance"". The documents show that the Dumy Call sign in Bilston Glen in Loanhead, Midlothian, was used from at least 2007 to 2015.the practice should not have been used in 2013 after the creation of the national police and had been permanently discontinued",Sad
"One of Scotland's most important police control rooms used a false system to manipulate the reaction times for eight years, according to documents seen by the BBC. Thousands of calls to the Bilston Glen Control Room were assigned to a fictional call sign known as DumyInternal systems would register that the calls were passed on to officers - but instead they were parked on a list. This meant that a police vehicle would not quickly be sent to calls that were judged as a high priority.It seems that many calls were not attended at all., Midlothian, used until the system was discovered and stopped in 2015.",Sad
"This video can not be played Pearl Higgins died in winter 2020 after being admitted to hospital A woman has described the ""painful experience"" of losing three relatives who contracted Covid-19 in hospital. Miranda Evans said being unable to be with her grandmother while she was in hospital left her family traumatised. Some restrictions in hospitals had ""many adverse effects"" on patients' physical and mental health, a new report into the management of Covid-19 in hospitals in Wales has found. The Welsh government said the findings would help improve services. The interim report was produced by the National Nosocomial Covid-19 Programme, which was established by the Welsh government in April 2020.  Its aim is to support health organisations to investigate the safety implications of the high number of hospital-acquired Covid infections during the pandemic. The report highlights ""early lessons"" following an assessment by NHS Wales of more than 5,000 ""patient safety incidents"", which occurred between March 2020 and April 2022. Patient safety incidents are cases where one or more patients could have come to harm after catching Covid in healthcare settings. Miranda Evans, 44, from Bridgend, lost her grandmother, uncle and aunt to Covid-19, all of whom contracted the virus in hospital.  Ms Evans' grandmother, Pearl Higgins, 92, was admitted to hospital with a stroke in September 2020. Due to visiting restrictions, Ms Evans and her mother were unable to visit her. ""She was taken into hospital and we never saw her again. We were unable to see my grandmother. We were unable to speak to her,"" she revealed. ""There was very few people on hand to take calls for families. It was an extremely painful experience."" Ms Higgins was moved to four different wards, which made her family anxious about the prospect of her contracting Covid.  A few months into her stay, Ms Higgins tested positive for Covid and was moved to the Covid ward immediately. After a few days in the ward, she passed away. Ms Evans and her family were unable to say their last goodbyes.  ""No-one found us to say she was dying. We found out after she had died. It was extremely traumatising. We were all beside ourselves. ""A bomb went off in our family. Our hearts were just aching. We all felt numb.  ""We had nightmares for months afterwards. My mum still has nightmares now. She dreams that my nan is lost in the hospital somewhere."" Ms Evans said she believed her grandmother may have survived if she had been able to see her family. ""She just needed a familiar face. She needed someone, just one relative, and that could have been my mother who had been shielding with her for three months solidly."" She added: ""Definitely valuable lessons to be learnt from this and for future pandemics, future emergencies, future diseases. So, we need to make sure that we're emergency planning now, you know, to make sure that we're catering for the needs of disabled people in their families."" NHS visiting restrictions were introduced on several occasions to try to limit Covid transmission into hospital and protect vulnerable patients.  But the report says these restrictions had ""many adverse effects on the physical and mental health of patients, especially those in vulnerable groups that the restrictions were intended to safeguard - who were not able to fully understand the decisions made"". ""The limited alternative opportunities for making contact and communicating with loved ones, also negatively impacted the experience of other service users, families and carers,"" it says. The report recommends all services and wards should have dedicated patients support teams to help families and carers having difficulty visiting loved ones. The report makes it clear that the ""scale of the pandemic"" meant hospital patients ""inevitably faced an increased risk"", especially at times when the virus was spreading widely in communities. The lack of testing capacity was a key problem during the early stages, it says. ""Demand exceeding capacity and the inability to test rapidly for Covid-19... meant that testing was somewhat ineffective as a mechanism for reducing infections, until the supply of consumables met demand and testing capacity increase,"" according to the report. It also said infections could have spread more easily because patients had to be moved around cramped and, in some cases, outdated hospital buildings, hindering the hospitals' ability to isolate people. The report recommends patients are seen ""in the right place, at the right time"", with any reasons for moving patients communicated quickly to their families. ""Do not attempt cardio-pulmonary resuscitation"" (DNACPR) decisions are designed to protect people from unnecessary suffering caused by receiving resuscitation they do not want, will not work or where the harms outweigh the benefits. But concerns emerged during the pandemic there was ""a blanket approach"" to their use along with a lack consultation with families. The report says ""the analysis did not identify evidence where DNACPR was used inappropriately"" or not in keeping with Wales-wide policy. However, it calls for better communication around ""this sensitive subject"", stressing families and carers need to be involved in the process as much as possible. It says the roll-out of an electronic advanced care planning document would be a key improvement and alleviate potential issues. The report identifies a number of further ""early lessons"", including the need for: The National Nosocomial Covid-19 Programme will continue to work with Welsh health organisations to identify further lessons, with a final report scheduled for spring 2024. So far the programme has looked at 5,000 of the ""most complex"" patient safety incidents where Covid was spread in hospitals. There are 18,000 cases in total to be assessed. The interim report acknowledges that while its contents ""may be upsetting for many... it is imperative that [it]... offers transparent insights that will lead to meaningful change"". However, it says the work does not ""seek to detract"" from the role of the UK Covid-19 Inquiry, which will likely hear evidence about the pandemic response in Wales along with the rest of the UK later this year. Deputy Chief Medical Officer for Wales Chris Jones said: ""The National Nosocomial Covid-19 Programme and Welsh government extend sincere condolences to those who lost loved ones after acquiring Covid-19 in healthcare settings.  ""These findings provide an extremely valuable national insights that will improve the quality and safety of healthcare services in Wales."" The meteoric rise and dizzying fall of tycoon Arif Naqvi Greg Foot untangles some of the most common claims with the help of experts Richard Bilton investigates the problems Margaret Thatcher's right-to-buy policy is causing 40 years later Dr. Matthew Walker shares his tips for getting more sleep © 2023 BBC. The BBC is not responsible for the content of external sites. Read about our approach to external linking.",Sad
"This video cannot be reproduced Pearl Higgins died in the winter of 2020 after being admitted to the hospital, a woman described the ""painful experience"" of losing three relatives who contracted COVID-19 at the hospital. Miranda Evans said noHe could be with his grandmother while he was in the hospital left his traumatized family. Some restrictions in hospitals had ""many adverse effects"" on the physical and mental health of patients, according to a new report on the management of COVID-19 in thehospitals in Wales. The Government of Wales said that the findings would help improve the services. The provisional report was produced by the National Nosocomial Program COVID-19, which was established by the Welsh government in April 2020. Its objective is to support theHealth organizations to investigate the security implications of the high number of COVID infections acquired in the hospital during the pandemia. The report highlights the ""early lessons"" after an evaluation of the Weld NHS of more than 5,000 ""patient safety incidents"",that occur",Sad
"This video cannot be played Pearl Higgins died in winter 2020 after being admitted to the hospital, a woman described ""the painful experience"" of losing three parents who contracted Covid-19 at the hospital.said that not being able to be with her grandmother while she was in the hospital left her traumatized family. Certain restrictions in hospitals have had ""many harmful effects"" on physical and mental healthPatients revealed a new report on COVVI-19 management in Wales hospitals. The Welsh government said that the results would help improve services. The interim report was produced by the National COVVI-19 program programNosocomial covid-19, which was created by the Welsh government in April 2020. Its objective is to support health organizations to investigate the safety implications of the high number of infections led to hospital during the pandemic.report highlights the ""first lessons"" following an assessment of the NHS Wales of more than 5,000 ""patient safety incidents"", which occur",Sad
"This video cannot be played, Pearl Higgins died in the winter of 2020 after being hospitalized.A woman described the ""painful experience"" to lose three relatives who agreed with Covid-19 in the hospital. Miranda Evans said I was unable to be with her grandmother while she was in the hospital, andLeave her family traumatized. ""Many adverse effects"" on the physical and mental health of patients, a new report on the management of Covid-19 in hospitals in Wales, had ""many adverse effects"".to improve the services. The provisional report was created by the National Nosocomial Covid-19 program, which was set up by the Welsh government in April 2020.Patient safety ""that occur",Sad
"This video cannot be played Pearl Higgins died in winter 2020 after being admitted to hospital, a woman described the 'painful experience' of the loss of three family members who sustained Covid-19 in hospital.Evans said she couldn't be with her grandmother while she was in hospital, her family traumatized.Handling of Covid-19 in Wales Hospitals found.is.Its purpose is to support health organizations to investigate the safety implications of the large number of hospital-reproached Covid infections during the pandemic.",Sad
"A third inspection in a year failed to find any major improvements at a north Wales hospital's emergency department. Staff at Glan Clwyd Hospital's A&E were said to be working tirelessly to give the best care possible, but the service still requires significant improvement. Inspectors said poor sepsis screening and triage and pain relief delays were putting patients at significant risk. Health Minister Eluned Morgan admitted there were still ""very, very serious problems"" at the department. Betsi Cadwaladr health board said progress needed to ""accelerate"". Inspectors' concerns about standards in the department were classified as the most significant, with minimal improvements since their two previous visits. The report comes a month after the health board was placed back in special measures following a damning audit report, and 11 independent board members were told to quit by the Welsh government. Healthcare Inspectorate Wales (HIW) visited the emergency department of the hospital in Bodelwyddan, Denbighshire, in November after previous visits in March and May of 2022. Their report again highlights an ""incredibly busy department, struggling with shortages of staff, high numbers of seriously unwell patients and a lack of space to treat them"". The same could be said of emergency departments across Wales, but the fact that so little has been done to improve things since two previous visits means it remains under HIW's highest level of scrutiny. HIW chief executive Alun Jones said: ""This inspection found evidence of a department struggling to cope with the day-to-day demand of providing a safe service to patients. ""It has highlighted areas such as poor team working between the ED [emergency department] and other departments within the hospital which, in turn, is compounding nationally recognised challenges around patient flow.  ""The health board will need to take strong and decisive action to tackle the issues identified in our inspection. We will continue to engage with the health board to ensure sustained action is taken in relation to our findings. ""Inspectors found the standard of patient notes had improved, however rotas were challenging as there was a heavy reliance on bank and agency staff because of recruitment and retention issues. ""While waiting times to see a doctor had improved since May, the flow of patients through the department was still extremely challenging. ""Waits to see a specialty doctor varied and inspectors found on some occasions those doctors refused to review patients waiting in the ED, leading to further delays."" HIW said it would continue to monitor the response of the health board very closely. The health board has apologised to patients who may not have received ""the level of care they deserved"". Dr Nick Lyons, executive medical director and interim deputy chief executive of Betsi Cadwaladr health board, noted improvements highlighted by inspectors but acknowledged ""we still have some way to go"" to improve care for all patients."" ""It is true staff within the ED at Glan Clwyd Hospital have been under enormous strain for the past three years and this has increased since restrictions eased,"" he said. ""Attempts to attract permanent members of staff to support the ED's work continues and another recruitment open day is planned within the next few weeks. ""However, the fragility in staffing and the volume of acutely unwell people we receive each day means we remain a service requiring significant improvement. ""The vast majority of our colleagues are a credit to our organisation and we value their hard work and professionalism. We will continue to strive to make sure they feel supported by colleagues in other specialties and their hospital management teams."" Dr Lyons said he noted ""with pride"" inspectors' comments about the commitment of staff, and the satisfaction of the ""majority of patients"" with their care. He added: ""Despite the issues raised in the report inspectors acknowledged progress has been made but we know this needs to accelerate. ""Our colleagues within ED, and in other areas of the hospital, are fully focused on driving this change forward and we are pleased to see the proportion of patients moving through the department within four hours continuing to rise."" Following publication of the inspection report, Health Minister Eluned Morgan agreed there were ""still very, very serious problems"" at Ysbyty Glan Clwyd and its emergency department ""in particular"". Answering questions in the Welsh Parliament, the minister said there had been ""serious discussions"" with Dr Lyons ""to ask about what exactly has been put in place"" to improve the situation. ""There seems to be a specific problem here with the emergency department in Ysbyty Glan Clwyd,"" she said. ""We've got to encourage"" the department to learn from the other emergency departments within Betsi Cadwaladr health board that are ""working better"", the minister said. There had been ""some encouraging improvements after the previous inspection"" but it was ""very disappointing that many of the issues have still not been fully resolved"". Ms Morgan was answering questions from members including Vale of Clwyd Conservative MS Gareth Davies, who later urged Ms Morgan to ""get a grip on the situation"" and ""stop passing the buck"".  ""Patients, along with the people of North Wales, deserve better,"" he added. The meteoric rise and dizzying fall of tycoon Arif Naqvi Greg Foot untangles some of the most common claims with the help of experts Richard Bilton investigates the problems Margaret Thatcher's right-to-buy policy is causing 40 years later Dr. Matthew Walker shares his tips for getting more sleep © 2023 BBC. The BBC is not responsible for the content of external sites. Read about our approach to external linking.",Provoking
"A third inspection in a year could not find important improvements in the emergency department of a hospital in northern Wales.a significant improvement. The inspectors said that the detection of poor sepsis and the delays in pain relief were putting patients with a significant risk. The Minister of Health, Eluned Morgan, admitted that there were still ""very, very serious problems""in the department. The Betsi Cadwaladr Health Board said that the progress should ""accelerate.""A month after the Health Board was replaced in special measures after a condemnatory audit report, and the Welsh government told 11 members of the independent board to resign. Wales Medical Care (HIW) visited theEmergency Department of the Hospital in B",Provoking
"A third inspection in one year did not find any major improvements to the emergency department of a hospital in North Galles. The staff of the GLAN CLWYD hospital would have worked tirelessly to give the best possible care, butThe service still requires significant improvement. Inspectors have declared that bad screening for sepsis and delays in treatment for sorting and pain relief put patients at significant risks. The Minister of Health, Eluned Morgan, admittedthat there were still ""very, very serious problems"" in the department.betsi Cadwaladr Health Board said that the progress necessary to ""accelerate"". The concerns of inspectors concerning the standards of the department have been classified as the most important, withA minimum of improvements from their two previous visits. The report occurs a month after the Health Council was submitted to special measures following an overwhelming audit report, and 11 independent members of the Board of Directorswere invited to resign from the Welsh Government. Inspectorate of health care (HIW) visited the emergency department of the hospital of B",Provoking
"A third inspection in one year did not find any major improvements in the emergency room of a hospital in a hospital.. Inspectors said that bad sepsis screening and the delays in pain relief from triage and pain relief were significantly at risk.said that progress to ""accelerate"" is necessary. The concerns of the inspectors about standards in the department have been classified with minimal improvements since their two previous visits than the most important.Measures had been returned, and 11 independent board members were announced by the Welsh government.",Provoking
"A third inspection in a year could not find major improvements at the emergency of North Wales Hospital.The service still requires significant improvement. Inspectors said that poor sepsis screening and delays in the triage and pain relief patients have a significant risk. Minister of health admitted that there were ""many, very serious problems"" to the department.Betsi Cadwaladr Health Board said the progress should 'accelerate'. Inspectors' concerns about standards in the department have been classified as the most important, with minimal improvements since their two previous visits. The report comes a month after the health council was placed in special measuresAfter a damning audit report, and 11 independent management members were told to stop by the Welsh government.",Provoking
"Rents for new lets have increased by 11.1% in January 2023 compared to the same month a year before. This figure varies greatly across the UK, with London rents increasing by 15.2%, while those in Northern Ireland increased by 5.7%. Use the tool below to see what the average prices are in your area and how they've increased in the past four years. You can listen to BBC Radio 4's Rental Health series on BBC Sounds. If you can't see the table, click here. The data comes from Zoopla's property listings, adjusted to reflect differences between asking and actual rents. The average rent figures shown are based on the median of one, two, three and four-bedroom homes for each month January, adjusted to reflect the mix of private rented homes in each area. The meteoric rise and dizzying fall of tycoon Arif Naqvi Greg Foot untangles some of the most common claims with the help of experts Richard Bilton investigates the problems Margaret Thatcher's right-to-buy policy is causing 40 years later Dr. Matthew Walker shares his tips for getting more sleep © 2023 BBC. The BBC is not responsible for the content of external sites. Read about our approach to external linking.",Provoking
"Rentals for new lets have increased by 11.1% in January 2023 compared to the same month of the previous year. This figure varies greatly throughout the United Kingdom, with the London rentals that increase by 15.2%, whilethat those of Northern Norther4 In BBC Sounds.If you cannot see the table, click here. The data comes from the listings of Zoople properties, adjusted to reflect differences between requesting and real rentals. The average rental figures shown are based on the medianof houses of one, two, three and four bedrooms for each month of January, adjusted to reflect the combination of rented private houses in each area. The meteoric ascent and the vertiginous fall of the magnate Arifvvi Greg Foot Foot unbalance some of the most common statementsWith the help of experts Richard Bilton investigates the problems that Margaret Thatcher's purchase policy is causing 40 years later",Provoking
