"The Minister establishes plans to use old army bases and perhaps ship to save money and dissuade people from coming to British asylum seekers who will be hosted in the most basic accommodation, includingThe bases of the abandoned army and possibly shipments, to save money and dissuade people becoming in the United Kingdom, said the government. In a declaration of commons defining the next step in plans aimed at reducing complianceAsylum in the United Kingdom, Robert Jenrick, the Minister of Immigration, said the plans would meet the legal requirements to ensure that those who arrived were not made ""helpless"", but nothing more.""We must not raise the well-being of illegal migrants above those of the British people,"" he told the deputies. In an answer, Jenrick seemed to argue that the government had to suppress the incentives to arriveBy small boats by being as ruthless as smugglers: ""They are among the most evil and pernicious people of society. You must have them match - you cannot behave in a weak and naive way.Pl",Controversial
"Minister sets plans to use old army bases and possibly ships to save money and disrupt people to come to British asylum seekers will be housed in the most basic accommodation, including unused army and possibly ships, to save money and to people fromPeople to disrupt the government said the government is coming to the UK. In a Commons statement that set out the next phase in the plans to reduce asylum claims in the UK, the Minister of Immigration Robert Jenricksaid the plans will meet the legal requirements to ensure that those who have arrived are not ""needy"" but nothing more, but nothing more. ""not elevated, 'he told MPs. In one answer, Jenrick seemed to argue that the government had to remove incentives to get through small boats by being just as ruthless as people who are smugglers:' They are from the worst,Most harmful people in society. You have to fit them - you can't act in a weak and naive way.'Jenrick's pl",Controversial
"UK chancellor tells MPs  high level of inflation means Treasury support is necessary to avoid cutting frontline services Jeremy Hunt has pledged to find additional money to help fund public sector pay deals after admitting that Britain’s high level of inflation has made it impossible for Whitehall departments to end strikes without Treasury support. The chancellor conceded on Wednesday that the only way the government could fund pay awards without cutting frontline services was if he provided financial support to cabinet colleagues. Speaking to the Treasury select committee, Hunt dropped his previous insistence that pay offers for doctors, nurses and teachers would have to be funded by departments making efficiency savings. The chancellor said that when the pay deals were completed, there would be “discussions with the Treasury” about the level of support. Making clear that the UK’s annual inflation rate of 10.4% created “special circumstances”, Hunt said there would need to be a deal on how much of the cost would be borne by the Treasury and how much through efficiency savings and reallocation of departmental budgets. “There will be discussions about how much help comes from the centre, but we haven’t had those discussions yet,” he said. The Treasury has a contingency reserve – a rainy-day fund – that Hunt can draw on to meet unforeseen spending needs. The chancellor said the government had made a commitment that there would be no cuts to frontline public services and that the discussions with departments would ensure that this pledge was met. Giving evidence to the committee of backbench MPs about his budget, Hunt said the annual inflation rate would fall in the coming months because last year’s sharp price rises in energy and food would not be repeated. However, he said the cost of living crisis was not over. “There are still inflationary pressures in the economy and I am very concerned about that.” Noting that inflation rose unexpectedly last month, the chancellor said: “We need to keep our eye on the ball. There is no room for complacency.” Hunt accepted that the highest inflation in four decades would lead to a 6% drop in living standards over two years. “I very much recognise the squeeze,” he said. “There is pressure on living standards. The long-term sustainable way to relieve that pressure is through economic growth.” Sign up to Business Today Get set for the working day – we'll point you to all the business news and analysis you need every morning after newsletter promotion The chancellor said the budget had contained measures to boost Britain’s sluggish growth rate, but he admitted the government would need to mitigate the risks posed by Joe Biden’s Inflation Reduction Act (IRA) – a $369bn (£299bn) package of subsidies designed to encourage firms to invest in green technology in the US. The chancellor said it was a “good thing” the US was taking the climate crisis seriously, adding that there was an element of catch-up in the American approach. But he accepted that the IRA posed risks to the UK’s green sector that the government would need to counter. While rejecting the idea the UK could match the US “subsidy for subsidy”, Hunt said the overall package offered needed to be attractive to investors. Hunt told MPs he would come up with a more detailed response to the IRA, and to the EU’s green deal package, in his autumn statement later in the year. ",Controversial
"The United Kingdom Chancellor tells MPS a high level of inflation inflation means that treasure support is necessary to avoid reducing first -line services Jeremy Hunt has committed to find additional money to help finance payment agreements of the payment of the payment agreements of the payment of the payment of the payment of thePublic sector after admitting that the high level of inflation in Great Britain has made it impossible for Whitehall's departments endFirst line services it was whether to provide financial support to the colleagues of the cabinet. In statements to the Select Treasury Committee, Hunt withdrew his previous insistence that salary offers for doctors, nurses and teachers should be financed by departments that achieve efficiency savings.The Foreign Minister said that when the salary agreements were completed, there would be ""discussions with the Treasury"" on the level of support, clear that the annual inflation rate of 10.4% of the United Kingdom created ""special circumstances,"" Hunt said thatThere should be an agreement",Controversial
"Strike without support for the treasury. The Chancellor conceded Wednesday that the only way in which the government could finance awards without reducing the front -line services if it provided financial support to the colleagues of the Cabinet.Hunt has abandoned its insistence prior to what the remuneration offers to doctors, nurses and teachers should be funded by departments achieving efficiency savings. The Chancellor said that when the remuneration agreements were concluded, therewould have ""discussions with the Treasury"" on the level of support. Clearly that the annual inflation rate of the United Kingdom of 10.4% created ""special circumstances"", Hunt said that it would be an agreement",Controversial
"The British Federal Chancellor announces that a high level of inflation means that the support of the Ministry of Finance is necessary to avoid Jeremy Hunt ISSTREIKS without Ministry of Finance. The Chancellor admitted on Wednesday that the government could only finance the financial wage awards,, on WednesdayWithout shortening the services for the front if he supported cabinet colleagues. In conversation with the Treasury Select Committee, Hunt said his previous existence that the payment offers for doctors, nurses and teachers would have to be financed by departments who achieve efficiency savings.If the salary qualifications were completed, there would be ""discussions with the Ministry of Finance"" about the level of support. Make it clear",Controversial
"The British Chancellor tells MPs a high level of inflation means that treasury support is needed to prevent the leading services promised by Jeremy Hunt, promised to find extra money to help finance the pay agreements in the public sector afterHe acknowledged that Britain's high inflation made it impossible for Whitehall departments to end. Strikes without Treasury Support.If he granted financial support to the Cabinet colleagues. Hunt spoke to the Treasury -selected committee, and Hunt dropped his previous insistence for pay offers for doctors, nurses and teachers to be funded by departments by efficiency savings.said that when the payment agreements were completed, there would be 'discussions with the Treasury' about the level of support.will have to be an agreement",Controversial
"John Nicolson’s tweets were assessed by parliament’s grievance scheme in six-month investigation A Scottish National party (SNP) MP has been cleared of bullying the former cabinet minister Nadine Dorries after a six-month investigation. John Nicolson, the SNP’s culture secretary, is understood to have been cleared after parliament’s Independent Complaints and Grievance Scheme (ICGS) assessed a series of tweets he made about Dorries while she was culture secretary in Boris Johnson’s cabinet. He criticised Dorries, calling her “a horrible disgusting woman”, “a “mendacious, vacuous Tory goon” and “thick as two short planks”. Nicolson liked the tweets posted by others after the pair engaged in a Commons select committee session, during which he questioned Dorries on her use of Twitter. After a number of exchanges during the digital, culture, media and sport committee hearing in November 2021, she said she was “not going to answer questions about tweets that I posted 12 years ago, or whenever it was”. At one point, Nicolson said: “It is hard to keep track of your tweets”, to which Dorries replied: “Not as hard as it is to keep track of yours.” The case was first reported by Politico UK. It marks the first case of a British politician being investigated by the ICGS over allegations of cyberbullying another MP. The ICGS was created in 2018 to get a grip on misconduct within parliament. A House of Commons spokesperson said: “Parliament’s ICGS operates on the basis of confidentiality for the benefit of all parties. Therefore, we cannot provide any information on any complaint, including whether or not a complaint has been received.” The SNP MP for Ochil and South Perthshire remains the subject of a separate investigation by the Commons privileges committee after he was accused of a “clear breach” of parliamentary rules for tweeting details of a letter from Commons speaker Lindsay Hoyle. Nicolson was forced to apologise after he posted part of a letter from Hoyle relating to his decision to not refer Dorries to the privileges committee after claims she had made misleading remarks on a Channel 4 programme. Sign up to First Edition Archie Bland and Nimo Omer take you through the top stories and what they mean, free every weekday morning after newsletter promotion Nicolson said he was “deeply sorry” that Sir Lindsay was upset and insisted there had been “no malicious intent” at the time. The investigation regarding that incident is ongoing. ",Controversial
"The John Nicolson Tweets were evaluated by the Clalia's claim scheme in the six -month investigation, a deputy of the Scottish National Party (SNP) was authorized to intimidate the former Minister of the Nadine Dorries Cabinet after a six -month investigation.It is understood that John Nicolsson, the SNP Secretary of Culture, was authorized after the complaints and the Complaints (ICGS) scheme of the Parliament evaluated a series of tweets he made about Dorries while she was a secretary of Culture in the Boris CabinetJohnson.A select session of the Commons, during which he questioned Dorries about its use of Twitter. After a series of exchanges during the hearing of the Digital Committee, Culture, Media and Sports in November 2021, he said that ""he was not going toAnswer questions about the tweets I published 12 years ago, or Whenev",Controversial
"John Nicolson's tweets were evaluated by the regime of grievances of Parliament in a six -month investigation, a deputy for the Scottish National Party (SNP) was authorized to intimidate the former minister of the cabinet Nadine Dorries after a six -month investigation.John Nicolson, the SNP culture secretary, was erased after the independent program of complaints and grievances of the Parliament (ICGS) assessed a series of tweets that he made about Dorries while she wasSecretary of culture of Boris Johnson's Cabinet. He criticized Dorries, calling him ""a horrible disgusting woman"", ""a"" recent and empty conservative goon ""and"" thick as two short plates "".nicolson liked the tweets published byothers after the pair was engaged in a session of the restricted committee of the municipalities, during which he interviewed dorries about his use of Twitter. After a certain number of exchanges during the hearing of the digital, cultural committee,, media and sport in November 2021, she said that she ""was not going to answer questions about the tweets that I published 12 years ago, or when Eve",Controversial
"The tweets of John Nicolson were investigated by the parliament's grievance scheme in six months, an MP of the Scottish National Party (SNP) was discharged from the bullying of former cabinet minister Nadine Dorries after a six -month investigation. John Nicolson,The SNP's cultural secretary was apparently cleaned after the independent complaints and grievance scheme (ICGs) of Parliament assessed a series of tweets he made about Dorries while his cultural secretary was in Boris Johnson's cabinet. He criticized Dorries and 'called a horrible disgusting woman "","" a ""thoughtful, subjective tory goon"" and ""thick as two short plans"" .Nicolson likes the tweets placed by others after the pair had a Commons Select Committee session, during whichHe questioned Dorries about her use of Twitter. After a number of exchanges at the trial of digital, culture, media and sports committee in November 2021, she said she ""will not answer questions about tweets I posted 12 years agohave not, or when not",Controversial
"Former military bases and cruise ships are among alternatives to hotels to house people seeking asylum in UK Ministers led by the home secretary, Suella Braverman, are desperate to stop the use of hotels at a cost of £6.2m a day for people seeking asylum in the UK. Conservative MPs are demanding extreme measures – here are some of the alternatives “not being ruled out” by the government. The immigration minister, Robert Jenrick, confirmed on Wednesday that former RAF sites in Essex and Lincolnshire are earmarked for development – but the government must yet face down legal threats and anger from local Conservatives. James Cleverly, the foreign secretary, has already voiced his opposition to the Essex site, which is in his constituency. A separate site on private land in Bexhill, East Sussex, will also be used, while Jenrick said Rishi Sunak was “showing leadership” by “bringing forward proposals” to use barracks in Catterick Garrison in his own constituency of Richmond, Yorkshire. The advantages include that there is plenty of space to build facilities. But the government’s previous attempt to build a detention centre at a former RAF base in Linton-on-Ouse was scrapped after a local outcry and legal threats. Labour say that the proposals will not reduce spending, “contrary to all of the briefing in the papers”. They say the new sites are in addition to hotels, not replacements. The facilities themselves will face criticism and possible legal challenges for being “grossly inadequate” for people who have fled war, charities have said. It is a mark of desperation within Downing Street that the idea of housing in cruise ships – this time a former liner from Indonesia, the Guardian has disclosed – is once again gaining currency in Whitehall. Jenrick confirmed the government was continuing to “explore the possibility of accommodating migrants in vessels”. Sunak proposed putting migrants on cruise ships moored around the country last summer but was warned it could be illegal under the Human Rights Act and the European convention on human rights. Sources suggested, however, that the cruise ships could be registered as hotels rather than detention centres to get around possible legal challenges. Some ocean liners can carry 3,000 guests, and they could be adapted, if they remain at port, to carry hundreds more. Former ministers have said that the idea was examined last year, while an official 2022 report said it would be more expensive than housing people in hotels. Not only were the ships themselves hugely expensive to maintain, it was “near impossible” to find insurance cover. Ministers have also declined to rule out a future use of barges, large flat-bottomed boats that have been used to house offshore construction workers, according to the Times. Accommodation barges are typically used to house workers for construction projects at sea such as oil refineries or offshore wind turbines. While some are basic, others are described as “floating hotels” – or flotels – and include restaurants, fitness areas, bars, kitchens and laundry facilities. The vessels can house hundreds of people – some of the bigger ones can accommodate more than 600. One recent barge, measuring 120 metres by 31 metres and capable of housing 300 people, cost more than £20m. A company called DSB Offshore advertises such barges for sale in the Gulf – but a price is not attached to each advertised barge. Cabins are communal, with two to four people to a room and shared bathrooms. All cooking and cleaning is taken care of. Modern rigs feature gaming areas, gyms and even theatres. The government’s often-heralded plan to send asylum seekers to Rwanda is still facing a number of challenges before it ever comes to fruition. The plan, first put forward by Boris Johnson and Priti Patel less than a year ago, was to send “tens of thousands” of asylum seekers to the central African country, where their cases would be assessed. Even if the refugees were granted leave to remain, they would be offered a new home in Rwanda, and not necessarily given a route to return to the UK. The idea, taken from a model first used in Australia, was based on the hope that it would put off those travelling across the Channel on small boats, and break the business model of smugglers. However, since the £140m plan was introduced, small boats crossings have soared and not a single plane has taken off to central Africa after legal challenges that could continue until the next general election. And the Rwandan government was forced to admit over the summer that they only had prepared accommodation to house several hundred people. Since then, Sunak and Braverman have gambled on the plan, coupled with hardline policies in the illegal migration bill, helping to put off asylum seekers from coming to the UK. A visit to Kigali last week by Braverman, which was widely ridiculed as a photo opportunity, aimed to assure Tory MPs and voters that the Rwandan government was building more accommodation. But other senior Conservatives have said that thousands of new places, funded by the UK taxpayer, will have to be built in Rwanda if the plan is to work. Patel told a newspaper that Home Office modelling showed many thousands of refugees would have to be successfully removed to Rwanda before a deterrent effect halts those seeking refuge in the UK. ",Controversial
"The old military bases and cruises are among the alternatives to hotels to accommodate people lookingof £ 6.2 million per day for people looking for asylum in the asylum in the unitedreino. The conservative parliamentarians are demanding extreme measures: these are some of the alternatives that ""are not being discarded"" by the Government. The Minister of Immigration, Robert Jenrick, confirmed on Wednesday that the former RAF sites in Essex and Lincolnshire are destined to development, but the government must still face legal threats and the anger of local conservatives. James intelligently, the Secretary of Foreign Affairs, has already expressed its oppositionTo the Essex site, which is in its constituency. A separate site will also be used in private lands in Bexhill, East Sussex, while Jenrick said that Rishi Sunak was ""showing leadership"" by ""presenting proposals"" to use barracks in Catterick GarrisonIn his own circumscription of Richmond, Yorkshire.",Controversial
"The old military bases and cruise ships are among the alternatives to hotels to accommodate people looking for asylum in the British ministers led by the interior secretary, Suella Braverman, are desperate to stop the use of'Hotels at a cost of 6.2 million pounds sterling per day for people looking for asylum in Leroyaume-Uni. Conservative deputies require extreme measures-here are some of the alternatives ""not being excluded"" byThe government. The Minister of Immigration, Robert Jenrick, confirmed on Wednesday that the former RAF sites in ESSEX and Lincolnshire were intended for development - but the government still has to face the legal threats and the anger of the anger ofLocal conservatives. Intelligently, the Minister of Foreign Affairs has already expressed his opposition to the Essex site, which is in his constituency. A separate site on private land in Bexhill, East Sussex, will also be used, while Jenrick ADeclared that Rishi Sunak ""showed leadership"" by ""advancing the proposals"" to use a barracks in Catterick Garrison in his own constituency of Richmond, Yorkshire.",Controversial
"Former military bases and cruise ships are among the alternatives to hotels to accommodate people who are looking for in the British ministers under the direction of the Interior Minister Suella Braverman asylum, be sure to use hotels at a price of 6.2 million GBP per day for humans, who are looking for asylum in an exhausted manner, in the united Kingdom. Conservative MPs demand extreme measures - here are some of the alternatives that are ""not excluded"" by the government. The Minister of Immigration Robert Jenrick confirmed on Wednesday that former RAF locations in Essex and Lincolnshire confirmedare intended for the development - but the government still has to be exposed to legal threats and anger from local conservatives.Private country in Bexhill, East Sussex, is also used, while Jenrick said that Rishi Sunak has ""leadership"" by putting on his own constituency of Richmond, Yorkshire, ""suggestions"" for using barracks in Catterick Garrison",Controversial
"Former military bases and vessels are one of the alternatives for hotels to house people looking for asylum in British ministers led by Home Secretary, Suella Braverman, is desperate to stop the use of hotels at a cost of £6.2 million a day for people who are asylum in the united kingdom. Conservative MPs demand extreme measures - here are some of the alternatives that are not excluded by the government.RAF websites in Essex and Lincolnshire are earmarked for development -but the government still has to face legal threats and anger of local conservatives.His constituency has been, pronounced. A separate site on private land in Bexhill, East Sussex, will also be used, while Jenrick said that Rishi Sunak 'leadership is displaying' by 'proposing' to bring up Barracks in Catterick Garrison in histo use own constituency Richmond, Yorkshire.",Controversial
"Former head of Conservative Christian Fellowship will look at religion’s positive impact as well as how faith groups cause harm  Ministers urged to be more aggressive in tackling issues within religious groups A sweeping review of the relationship between faith and the state in recent times is due to be published within weeks, urging ministers to crack down on oppression, violence and radicalisation in religious settings. The report, by Colin Bloom, will be unveiled by Michael Gove’s Department for Levelling Up, Housing and Communities. While Westminster’s attention has been captured by the pandemic, Partygate and the mini-budget meltdown, Bloom has quietly been working on one of the most sweeping government investigations ever undertaken into religion in modern Britain. His remit was simply to review how best the government should engage with faith groups in the UK, and those close to the process say he has been rigorous in his fieldwork, talking to representatives from a range of faith groups. Much of Bloom’s report will lay out the positive impact he believes religion plays in society, something he will say was highlighted when Britain went into lockdown, closing many places of worship in the process. But some of the most interesting and controversial recommendations will deal with where he believes faith groups are causing harm. Many of his conclusions chime with those of his boss, Michael Gove, who has said for years that he believes Muslim madrasas in particular help foment radicalism – claims that have been disputed by Islamic organisations. Bloom was appointed in 2019 but his report has been delayed multiple times. First, the pandemic made it difficult for him to interview people, and then towards the end of last year, Gove decided he wanted to read the report himself before it was published. In the end, many of Bloom’s recommendations are timely: ultra-Orthodox Jewish schools have been in the news, while his warnings about Sikh nationalism will resonate after the recent attacks on the Indian high commission in London. ",Provoking
