"""Dear younger me, you should have stayed outside the tanning beds."" This is the message that the wwe wrestler, Alexa Bliss, had for her after having followed a treatment for skin cancer.A real name of 31 years, Lexi Cabrera, published an Instagram photo during the weekend showing Stiches where cancer had been deleted. She said to the fans that she was ""clear"" from the State and urged them to""Always have your skin checked ... If you are in the sun or use tanning beds"". Partying her story, Alexa, WWE women's champion, said she had noticed a place on her face ""was aggravated ""."" So I went to get a biopsy, ""she wrote. This article contains content provided by Twitter. We ask for your authorization before everything is loaded, because they can use cookies andOther technologies. You may want to read Twitter Cookie's policy, external and confidentiality policy, external before accepting. To display this content, choose ""Accept and continue"". Alexa says it was diagnosed witha carcinoma with basal cells, which generally begins like an L",Provoking
"""Dear younger I, I should have kept yourself away from browning beds."" That is the message that WWE wrestler Alexa Bliss had for herself after she had treated because of skin cancer. The 31-year-old, real name Lexi Cabrera,Instagram photo released in which stabs the cancer had been removed had been removed, she told the fans that she was ""very clear"" and urged her to always check her skin ... if she was in the sunare or use browning beds "". The five-time WWE women's master Alexa told her story and said that she had noticed a place on her face"" who had gotten worse ""."" So a biopsy went, ""she wrote. This article contains content ofTwitter. We ask for your permission before something is loaded because you may be using cookies and other technologies. You may want to read the Cookie Directive of Twitter, external and data protection regulations before accepting this content.Accept and continue "".alexa says",Provoking
"""Dear younger me, you should have stayed outside tanning beds."" This is the message the WWE wrestler Alexa Bliss had for herself after undergoing skin cancer treatment. The 31 -year -old, real name Lexi Cabrera, has the weekendAn Instagram photo posted with stems where the cancer was removed. She told fans that she was' all clear 'of the condition and urged them to' always see your skin ... if you are in the sun ortanning beds used 'by sharing her story, five-time WWE women's champion Alexa said she noticed a place on her face ""that got worse"".Article contains content provided by Twitter.'Accept and continue'.Alexa says she was diagnosed with a basal cell carcinoma, which usually starts as a l",Provoking
This video can not be played What's the best leaving present for a colleague who's a massive Fulham FC fan? BBC Newsbeat presenter Pria Rai might have the answer. She arranged for a special guest to gatecrash 1Xtra DJ Reece Parkinson's final interview.  Cottagers fan Reece got a huge surprise - and a side helping of banter - as he said farewell. Read more: A goodbye surprise for 1Xtra DJ Reece Parkinson © 2023 BBC. The BBC is not responsible for the content of external sites. Read about our approach to external linking.,Amusing
"This video cannot be reproduced, which is the best gift to leave for a colleague who is a massive Fulham FC fan? BBC presenter Newsbeat, Pria Rai, could have the answer. She organized a special guest for the final interview ofGatecrash 1xtra Dj Reece Parkinson.The Cottagers fan, reece, received a big surprise, and one of the jokes, as he said goodbye. Lead more: a surprise for farewells for 1xtra dj Reece Parkinson © 2023 BBC.La BBC is not responsibleof the content of external sites.",Amusing
"This video cannot be played which is the best who leaves the present for a colleague who is a big fan of Fulham FC? The presenter of BBC Newsbeat, Pria Rai, could have the answer. She organized a special guest for Gatecrash 1XtraDj Reece Parkinson.The fan of Cottager Reece had a huge surprise - and a joke help - as he said goodbye. Like the rest: a goodbye surprise for 1xtra DJ Reece Parkinson © 2023 BBC.'is not responsible for the content of external sites. Elise our approach to the external link.",Amusing
This video cannot be played.What is the best for a colleague who is a massive fulham -fc fan? The BBC Newsbeat moderator Pria Rai could have the answer. They arranged a special guest from Gatecrash 1xtra DJ Reece Parkinson's last interview.Big surprise - and a secondary balance of jokes - as he said goodbye. Read more: A farewell surprise for 1xra DJ Reece Parkinson © 2023 BBC.The BBC is not responsible for the content of external websites. Read about our approach to external link.,Amusing
"When you think of small music venues Adele and Ed Sheeran might not be the first names that spring to mind.  But both are just two of the UK's biggest artists who started their careers in grassroots venues.  Those small bars, pubs and clubs - a crucial springboard for new acts - are struggling, with a charity now predicting one could be lost each week. The Music Venue Trust says 2023 will be the worst year for closures since it formed in 2014.  Singer-songwriter CMAT is also worried about the future of grassroots music. Speaking to BBC Newsbeat backstage at London's Royal Albert Hall, she's about to support Grammy-winning duo Wet Leg at their Teenage Cancer Trust gig. CMAT, real name Ciara Thompson, recently won Ireland's Choice Music Prize for Best Album of the Year, and she's under no illusions about how she's got to where she is. ""I literally wouldn't have a career if it wasn't for open mic nights in small venues,"" she says. ""That was literally the first five years of my career - turning up on a Tuesday night with my guitar and asking 'can I do my songs now?'"" she says. But, since the pandemic, and the cost-of-living crisis that's followed, more and more small venues are disappearing. According to the Music Venue Trust, 22 grassroots venues have closed for good since April 2022. The charity expects more will go - possibly one a week - once government energy bill support for small businesses is cut back from 1 April. CMAT fears losing too many pubs and clubs will lead to music being dominated by those who've made a name through TikTok or privileged artists who ""start off on an elevated platform"". It's something singer and rapper Berwyn can relate to. ""Smaller venues were incredibly important to my career,"" he tells Newsbeat. The 26-year-old is now signed to a major label and playing shows across the UK, but says performing at local venues was ""training"" for bigger things.  ""The industry works in a larger format, you climb up from level to level and before you know it you're at Madison Square, you're at Wembley, but that level system is important."" ""Things have to develop naturally, you can't put a seed in the ground and expect it to go up and then then go down and and come back up again."" Berwyn says it's important for ""everyday people"" with big ambitions to ""have the opportunity to to play small venues and increase and grow"". ""Where would Ed Sheeran be without small venues? Where would Adele be without small venues? These are some of the most important artists in the culture of our times."" Ben Morgan is the events manager at the Snug in Atherton, near Bolton, Greater Manchester.  Like other small venues, it relies on ticket and bar sales to make a profit, but ""footfall is down because people have less money to come out,"" says Ben. The cost-of-living crisis has also hit bar sales. ""So not only do we have fewer people in the venue, but the people who do come are unable to spend as much money as they did before,"" says Ben. That's having an effect on line-ups - Ben would like to put lesser-known bands on the bill, but rising costs mean he's stuck to more recognised names guaranteed to bring in customers.  And it's this, Ben argues, that's damaging the music industry.  ""Without us there is no stepping stone for them,"" he says.  ""You will see fewer and fewer acts being able to make it to the big stage.  ""They won't have that practice, they won't have those skills from performing at grassroots music venues like ours to take on further in their career"". Music Venue Trust CEO Mark Davyd agrees that the ""entire music industry"" should be ""very worried about the future"".  Most have a ""really, really tough relationship with landlords,"" Mark tells Newsbeat, and one of the biggest issues is that most venues don't own the buildings they're based in. It's why the trust launched a new scheme last year - allowing fans to buy shares in venues to enable the charity to purchase them. The Snug was among nine venues selected for the pilot project when its former owners put it up for sale. If the fundraising project is successful it will be able to pay a reduced rent to the trust,  Ben says this will help to ""secure the long-term future of The Snug"" and the other eight sites. Trust CEO Mark says energy bills are ""completely absurd"" at present still a big problem for venues. He wants the government to do more to help. Creative Industries Minister Julia Lopez is due to meet the trust to discuss issues facing the live music sector. A spokesperson for the Department of Culture, Media and Sport told Newsbeat it was doing all it could to support grassroots venues - ""the lifeblood of our world-leading music sector"".  They said £1.57bn had been given out in the pandemic through the Culture Recovery Fund, and further help was being provided through the Supporting Grassroots Live Music fund via Arts Council England. Follow Newsbeat on Twitter and YouTube. Listen to Newsbeat live at 12:45 and 17:45 weekdays - or listen back here. The meteoric rise and dizzying fall of tycoon Arif Naqvi Greg Foot untangles some of the most common claims with the help of experts Richard Bilton investigates the problems Margaret Thatcher's right-to-buy policy is causing 40 years later Dr. Matthew Walker shares his tips for getting more sleep © 2023 BBC. The BBC is not responsible for the content of external sites. Read about our approach to external linking.",Provoking
"When you think of small places of music, Adele and Ed Sheeran could not be the first names that come to mind. But both are only two of the largest artists in the United Kingdom who began their careers in base places. Three small bars, pubs and clubs, a crucial springboard for new acts, are struggling, with a beneficial organization that now predicts that one could get lost every week. Music Venue Trust says that 2023 will be the worst year for closures since it was formed in 2014.The singer and singer CMAT is also concerned about the future of grassroots.Teenage Cancer Trust.cmat, the real name Ciara Thompson, recently won the Choice Music Prize in Ireland to the best album of the year, and has no illusions about how it has reached where it is. ""It would literally not have a race if it were not for theOpen microphone nights in small places, ""she says."" That was literally the first five years of my career - You",Provoking
"When you think of small music places, Adele and Ed Sheeran may not be the names that come to mind. But the two are only two of the greatest artists in the United Kingdom who have started their careers inBasic sites. These small bars, pubs and clubs - a crucial springboard for new acts - are in difficulty, a charitable organization predicting now that one could be lost every week. The music from Trust claims that 2023 will beWorse year for closings, because it formed in 2014. The singer-songwriter CMAT is also concerned about the future of basic music.Hall of London, she is about to support the duo of the Grammy Duo's leg during their concert of the teen cancer.cmat, the real name Ciara Thompson, recently won the prize for music from Choice D'Ireland for the best album of the year, and she has no illusions on the way she arrived where she is. ""I would literally have no career if it was not for the nights of microopen in small sites, ""she said."" It was literally the first five years of my career - you",Provoking
"If you think of small music rooms, Adele and Ed Sheeran may not be the first names that emerge. But both are just two of the biggest artists in the UK who started their careers in grassroots plane.And clubs - an important springboard for new acts - are struggling, with a charity now predicting one could be lost every week. The Music Venue Trust says 2023 will be the worst year for closures since it was founded in 2014.Singer-songwriter Cmat is also concerned about the future of grassroots music. She spoke to BBC Newsbeat behind the stage in London Royal Albert Hall and is about to support the Grammy award-winning duo wet leg at their Teenage Cancer Trust-action.cmat, real name Ciara Thompson, recently won Ireland's choice music prize for the best album of the year, and she is under no illusions about how she comes where she is.If it wasn't for an open microphone in small places, ""she says."" It was literally the first five years of my career - Tu",Provoking
"This video can not be played Tony Bellew visits Anthony Joshua's training camp in Texas, where new trainer Derrick James is ""pushing to rebuild"" the fighter to his full potential - starting with his return against Jermaine Franklin on Saturday in London. Listen on BBC Radio 5 Live and follow live text commentary on the BBC Sport website and app of Joshua's return from 21:00 BST on Saturday, 1 April. Pictures courtesy of DAZN. © 2023 BBC. The BBC is not responsible for the content of external sites. Read about our approach to external linking.",Inspirational
"This video cannot be reproduced that Tony Bellew visits the training camp of Anthony Joshua in Texas, where the new coach Derrick James is ""pressing to rebuild"" the fighter at its maximum potential, starting with his return against Jermaine Franklin on Saturday in London.Escuche in BBC Radio 5 live and follow the live text comments on the BBC Sport website and the application of Joshua's return from 21:00 BST on Saturday, April 1. FOOTS courtesy of Dazn. © 2023 BBC.BBC is not responsible for the content of external sites.",Inspirational
"This video cannot be played Tony Bellew visits Anthony Joshua's training camp in Texas, where the new coach Derrick James ""pushes to rebuild"" the fighter to his full potential - starting with his return against Jermaine Franklin on Saturday toLondon. Look on BBC Radio 5 Live and follow live text comments on the BBC Sport website and the return of Joshua's return from 9:00 p.m. BST on Saturday April 1. Photos Gracieuseé de Dazn. © 2023 BBC.The BBC is not responsible for the content of external sites. Elise our approach to the external link.",Inspirational
"This video cannot be played.Tony Bellew visits Anthony Joshua's training camp in Texas, where the new coach Derrick James ""rebuild the fighter"" - starting with his return against Jermaine Franklin on Saturday in London. Listen BBC Radio 5 Live and follow live text comments on theBBC Sport website and the app of Joshua's return from 9:00 p.m. on Saturday, April 1st,. Images with the friendly approval of DAZN. © 2023 BBC.The BBC is not responsible for the content of external websites.Approach to external link.",Inspirational
"This video can't be played Tony Bellew visits Anthony Joshua's training camp in Texas, where new coach Derrick James tries to rebuild the fighter to his full potential - starts with his return against Jermaine Franklin on Saturday in London. Listen on BBC Radio 5Live and follow direct text comments on the BBC Sport website and app of Joshua's return from 21:00 BST on Saturday 1 April. Photos courtesy of Dazn. © 2023 BBC.The BBC is not responsible for the content of external sites. Read about our approach to external link.",Inspirational
"Avon and Somerset police refer themselves to IOPC after fatal assault on 86-year-old in Somerset A man is being held in a secure mental health unit after an 86-year-old woman died in an attack at her cottage in a Somerset village. Avon and Somerset police have referred themselves to the police watchdog with regards to the action they took after a missing person report hours before the fatal assault. The woman has been named locally as Beryl “Bez” Purdy, who was well known in the village of Broomfield, near Taunton. Officers were called out to a reported burglary at about 5.45pm on Monday. When they arrived, they found Purdy badly injured. Paramedics and police officers tried to save her but were unsuccessful. A murder investigation led by the force’s major crime investigation team has been launched and a postmortem was conducted on Tuesday, but formal identification has not yet taken place. Police said a man in his 30s was arrested in connection with the incident. He was assessed by a mental health professional and deemed unfit for interview or to be detained in police custody. He was sectioned on Tuesday night under the Mental Health Act and transferred to a secure unit. The neighbourhood chief inspector, Justin French, said: “Our thoughts remain with the family during this incredibly difficult time and they are being supported by specially trained family liaison officers. “Incidents of this kind are rare and understandably can cause concern among the community. “Our officers will be out and about conducting reassurance patrols and we encourage people to speak to them with any questions and concerns they may have. “The public can expect to see an increased police presence in the area for the next few days.” The force added: “A mandatory conduct referral has been made to the Independent Office for Police Conduct (IOPC) concerning the action taken following a missing person report made earlier in the day.” It refused to give more details. Flowers were left near the scene paying tribute to Purdy. One tribute said: “Bez – there are no words. Out thoughts are with you and your family.’’ In December 2020, Purdy was pictured in the Somerset County Gazette outside St Mary and All Saints church, where she was a warden, after it received a grant to help repairs. She was also the booking secretary for Broomfield village hall and it is understood that she cared for her husband, Peter. In 2012, Purdy’s 46-year-old daughter, Alison, a police officer, diedafter a horse riding accident. The IOPC said it was assessing Avon and Somerset’s referral. ",Sad
"Avon and Somerset Police refer to IAPC after a fatal assault at 86 years in Somerset, a man is arrested in a safe mental health unit after an 86 -year -old woman died in an attack in her cabin in a villageof Somerset.avon and the Police of Somerset have referred to the police guardian dog regarding the action they took after a person report missing hours before the fatal assault. The woman has been named locally as Beryl ""Bez"" Purdy, which was known in the town of Broomfield, near Taunton. The officers were called a robbery reported around 5.45 p.m.Monday, when they arrived, they found Purdy seriously injured. The paramedics and police officers tried to save her, but were not successful. A murder investigation led by the main crime investigation team of the force and a postmortem was carried outOn Tuesday, but there has not yet a formal identification. The police said that a man in his 30s was arrested in relation to the incident. It was evaluated by a",Sad
"The police of Avon and Somerset referred to the IOPC after a deadly assault against 86 years in Somerset, a man is detained in a secure mental health unit after an 86 -year -old woman died in an attack in herChalet in a village of Somerset.Avon and the Somerset police referred to the police guard dog with regard to the action they took after a report of a missing person a few hours before the deadly attack.Woman was named locally like Beryl ""Bez"" Purdy, who was well known in the village of Broomfield, near Taunton. The police were called on Monday to a burglary reported around 5:45 pm. When they arrived, they found Purdy badly wounded.The paramedical paramedics and the police tried to save her but failed. A survey on the murder led by the main investigation team on the crime of the Force was launched and a post-mortem was conducted on Tuesday, but theformal identification has not yet taken place. The police said that a man in the thirties had been arrested as part of the incident. He was evaluated by a",Sad
"The Avon and Somerset police refer to IOPC after the 86-year-old in Somerset is captured in a safe psychiatric department after an 86-year-old woman died in an attack in her cottage in a village Somerset.Avon and Somerset referred to the police guards in relation to the measures they took after hours before the deadly attack.The officials were called to a reported burglary on Monday at 5:45 p.m., when they arrived, they were seriously injured. Purdy tried to save them and police officers, but were unsuccessful., was initiated and a postmortem was carried out on Tuesday, but no formal identification has yet been taken. The police said a man in the thirties was arrested in connection with the incident",Sad
"Police in Avon and Somerset refer themselves to IOPC to fatal assault on the 86-year-old man in Somerset, a man is being held in a safe unit for mental health after an 86-year-old woman in an attack on her cottage 'a Somerset village died.The police in Avon and Somerset referred themselves to the police watchdog regarding the action they did after a missing person who reported hours before the fatal assault.Beryl “Bez” Purdy, known in the village of Broomfield, near Taunton.Unsuccessful. A murder investigation led by the Force's biggest crime investigation team was launched on Tuesday and a postmortem was conducted on Tuesday, but formal identification has not yet taken place. According to police, a man in his thirties was arrested in connectionwith the incident.He was judged by a",Sad
"MP Julian Knight, who has always denied any wrongdoing, says he is facing a ‘witch-hunt’, and that whips’ office ‘acted disgracefully’ MP Julian Knight said he is facing a “witch-hunt” after his call for restoration of the Tory whip was rejected over “further complaints” made against him. The Conservative party said on Wednesday that it would not restore the whip to Knight after police dropped an investigation into an allegation of serious sexual assault against him. The MP for Solihull had always strongly rejected any wrongdoing after the complaint was made about him to the Metropolitan police, saying he had been targeted by unfounded rumours and blackmail. The Metropolitan police confirmed it was no longer investigating the matter. Knight, who was suspended from the Conservative party over the claim, always denied the allegation and demanded the “immediate” return of the party whip. However, a spokesperson for chief whip, Simon Hart, said Knight would not have the whip restored “following further complaints made to the whips’ office”. “These complaints, if appropriate, will be referred to the relevant police force, or appropriate bodies,” they said. Scotland Yard received an allegation of serious sexual assault on 28 October last year, and on 7 December a further referral relating to the incident was made, prompting an investigation into Knight. No details of the allegation were released at the time. Knight criticised the whips’ office, accusing it of a “desperate attempt to cover up the identities and motives of those in parliament who colluded for many months to bring the false allegation against me to the police”. “The police have confirmed today that there is no evidence to support that allegation and closed their investigation. They did not even need to interview me to do so,” he said. “Yet the whips’ office now seems intent on continuing a witch-hunt against me in an attempt to prevent my naming names.” Knight also criticised the Tory whips’ office for “acting disgracefully” by removing his anonymity when the further complaint was made. “The fact is that there was never anything for the police to investigate. This was a single, false and malicious allegation initially brought to them by third parties, each of whom had their own clear motives for doing so. “In publicly naming me in connection with the allegation, the Conservative whips’ office acted disgracefully and in breach of natural justice by removing my anonymity. Their actions meant my name was dragged through the mud and my good reputation immeasurably damaged. “The conduct of one person in the whips’ office, and the language used towards me, was particularly egregious. “Had the police taken the simple step at outset of interviewing me under caution, they would have seen that the allegation was false and scandalous. Instead, they waited four months, without ever talking to me, before deciding there was nothing for them to investigate.” Last month, Knight complained to the Metropolitan police commissioner, Sir Mark Rowley, about the handling of the allegation, writing to the police chief to call the investigation “flawed and fundamentally unjust”. Knight, who chairs the Commons digital, culture, media and sport select committee, has been an MP since 2015. ",Provoking
